{
  "atlas_schema": "atlas-snapshot/0.1",
  "id": "s4b_simulated_baseline",
  "title": "Counterfactual companion: do nothing (simulated)",
  "world": "restaurant-v0",
  "branch": "sim:baseline",
  "mode": "SIMULATE",
  "claim_class": "simulated",
  "t": 1791338400,
  "ts": "2026-10-06T19:00:00-07:00",
  "engine": "oracle-0.1.0",
  "narrative": "Same branch point and arrivals, no intervention. Differs from the observed 19:00 state because durations are nominal, not jittered: this gap is the calibration signal.",
  "state": {
    "t": 1791338400,
    "ts": "2026-10-06T19:00:00-07:00",
    "ledger_events_applied": 1060,
    "employees": {
      "emp_01": {
        "on_shift": true,
        "station": "st_prep"
      },
      "emp_02": {
        "on_shift": true,
        "station": "st_grill"
      },
      "emp_03": {
        "on_shift": true,
        "station": "st_fry"
      },
      "emp_04": {
        "on_shift": true,
        "station": "st_prep"
      },
      "emp_05": {
        "on_shift": true,
        "station": "st_pass"
      },
      "emp_06": {
        "on_shift": true,
        "station": null
      }
    },
    "equipment": {
      "eq_prep_table_1": {
        "status": "OPERATIONAL",
        "capacity": 4,
        "nominal_capacity": 4
      },
      "eq_grill_1": {
        "status": "OPERATIONAL",
        "capacity": 8,
        "nominal_capacity": 8
      },
      "eq_fryer_1": {
        "status": "OPERATIONAL",
        "capacity": 3,
        "nominal_capacity": 3
      },
      "eq_fryer_2": {
        "status": "DEGRADED",
        "capacity": 2,
        "nominal_capacity": 3
      }
    },
    "stations": {
      "st_prep": {
        "status": "NORMAL",
        "staff": [
          "emp_01",
          "emp_04"
        ],
        "capacity": {
          "equipment": 4,
          "staff": 4,
          "effective": 4
        },
        "queue": [],
        "in_progress": [
          "w_0077_1_prep",
          "w_0077_2_prep",
          "w_0078_1_prep"
        ]
      },
      "st_grill": {
        "status": "NORMAL",
        "staff": [
          "emp_02"
        ],
        "capacity": {
          "equipment": 8,
          "staff": 4,
          "effective": 4
        },
        "queue": [],
        "in_progress": [
          "w_0074_1_grill",
          "w_0075_1_grill"
        ]
      },
      "st_fry": {
        "status": "OVERLOADED",
        "staff": [
          "emp_03"
        ],
        "capacity": {
          "equipment": 5,
          "staff": 3,
          "effective": 3
        },
        "queue": [
          "w_0064_3_fry",
          "w_0063_1_fry",
          "w_0065_2_fry",
          "w_0066_2_fry",
          "w_0068_2_fry",
          "w_0070_2_fry",
          "w_0071_2_fry",
          "w_0069_1_fry",
          "w_0072_2_fry",
          "w_0071_1_fry",
          "w_0074_2_fry",
          "w_0073_1_fry",
          "w_0076_2_fry",
          "w_0076_1_fry",
          "w_0078_2_fry"
        ],
        "in_progress": [
          "w_0060_1_fry",
          "w_0061_2_fry",
          "w_0062_2_fry"
        ]
      },
      "st_pass": {
        "status": "NORMAL",
        "staff": [
          "emp_05"
        ],
        "capacity": {
          "equipment": 2,
          "staff": 2,
          "effective": 2
        },
        "queue": [],
        "in_progress": [
          "w_0058_0_pass"
        ]
      }
    },
    "orders_open": [
      {
        "id": "o_0057",
        "state": "READY",
        "created": "2026-10-06T18:38:14-07:00",
        "age_s": 1306,
        "items": [
          "prod_chicken",
          "prod_fries"
        ],
        "total": 16
      },
      {
        "id": "o_0058",
        "state": "OPEN",
        "created": "2026-10-06T18:40:02-07:00",
        "age_s": 1198,
        "items": [
          "prod_chicken",
          "prod_burger",
          "prod_drink"
        ],
        "total": 26
      },
      {
        "id": "o_0060",
        "state": "OPEN",
        "created": "2026-10-06T18:40:45-07:00",
        "age_s": 1155,
        "items": [
          "prod_chicken"
        ],
        "total": 12
      },
      {
        "id": "o_0061",
        "state": "OPEN",
        "created": "2026-10-06T18:45:31-07:00",
        "age_s": 869,
        "items": [
          "prod_burger",
          "prod_fries",
          "prod_drink"
        ],
        "total": 18
      },
      {
        "id": "o_0062",
        "state": "OPEN",
        "created": "2026-10-06T18:45:43-07:00",
        "age_s": 857,
        "items": [
          "prod_burger",
          "prod_fries",
          "prod_drink"
        ],
        "total": 18
      },
      {
        "id": "o_0063",
        "state": "OPEN",
        "created": "2026-10-06T18:45:44-07:00",
        "age_s": 856,
        "items": [
          "prod_chicken",
          "prod_drink"
        ],
        "total": 14.5
      },
      {
        "id": "o_0064",
        "state": "OPEN",
        "created": "2026-10-06T18:46:52-07:00",
        "age_s": 788,
        "items": [
          "prod_salad",
          "prod_salad",
          "prod_fries",
          "prod_drink"
        ],
        "total": 24.5
      },
      {
        "id": "o_0065",
        "state": "OPEN",
        "created": "2026-10-06T18:47:43-07:00",
        "age_s": 737,
        "items": [
          "prod_burger",
          "prod_fries",
          "prod_drink"
        ],
        "total": 18
      },
      {
        "id": "o_0066",
        "state": "OPEN",
        "created": "2026-10-06T18:48:34-07:00",
        "age_s": 686,
        "items": [
          "prod_burger",
          "prod_fries"
        ],
        "total": 15.5
      },
      {
        "id": "o_0068",
        "state": "OPEN",
        "created": "2026-10-06T18:49:23-07:00",
        "age_s": 637,
        "items": [
          "prod_salad",
          "prod_fries",
          "prod_drink"
        ],
        "total": 15.5
      },
      {
        "id": "o_0069",
        "state": "OPEN",
        "created": "2026-10-06T18:51:46-07:00",
        "age_s": 494,
        "items": [
          "prod_chicken",
          "prod_drink"
        ],
        "total": 14.5
      },
      {
        "id": "o_0070",
        "state": "OPEN",
        "created": "2026-10-06T18:52:50-07:00",
        "age_s": 430,
        "items": [
          "prod_burger",
          "prod_fries",
          "prod_drink"
        ],
        "total": 18
      },
      {
        "id": "o_0071",
        "state": "OPEN",
        "created": "2026-10-06T18:53:10-07:00",
        "age_s": 410,
        "items": [
          "prod_chicken",
          "prod_fries",
          "prod_drink"
        ],
        "total": 18.5
      },
      {
        "id": "o_0072",
        "state": "OPEN",
        "created": "2026-10-06T18:53:34-07:00",
        "age_s": 386,
        "items": [
          "prod_burger",
          "prod_fries",
          "prod_drink"
        ],
        "total": 18
      },
      {
        "id": "o_0073",
        "state": "OPEN",
        "created": "2026-10-06T18:54:14-07:00",
        "age_s": 346,
        "items": [
          "prod_chicken",
          "prod_drink"
        ],
        "total": 14.5
      },
      {
        "id": "o_0074",
        "state": "OPEN",
        "created": "2026-10-06T18:54:59-07:00",
        "age_s": 301,
        "items": [
          "prod_burger",
          "prod_fries"
        ],
        "total": 15.5
      },
      {
        "id": "o_0075",
        "state": "OPEN",
        "created": "2026-10-06T18:56:38-07:00",
        "age_s": 202,
        "items": [
          "prod_burger",
          "prod_drink"
        ],
        "total": 14
      },
      {
        "id": "o_0076",
        "state": "OPEN",
        "created": "2026-10-06T18:57:15-07:00",
        "age_s": 165,
        "items": [
          "prod_chicken",
          "prod_fries",
          "prod_drink"
        ],
        "total": 18.5
      },
      {
        "id": "o_0077",
        "state": "OPEN",
        "created": "2026-10-06T18:59:39-07:00",
        "age_s": 21,
        "items": [
          "prod_burger",
          "prod_burger",
          "prod_drink"
        ],
        "total": 25.5
      },
      {
        "id": "o_0078",
        "state": "OPEN",
        "created": "2026-10-06T18:59:58-07:00",
        "age_s": 2,
        "items": [
          "prod_chicken",
          "prod_fries",
          "prod_drink"
        ],
        "total": 18.5
      }
    ],
    "work_open": [
      {
        "id": "w_0060_1_fry",
        "order_id": "o_0060",
        "station_id": "st_fry",
        "step": "fry",
        "state": "IN_PROGRESS",
        "queued": "2026-10-06T18:43:02-07:00",
        "started": "2026-10-06T18:57:03-07:00"
      },
      {
        "id": "w_0061_2_fry",
        "order_id": "o_0061",
        "station_id": "st_fry",
        "step": "fry",
        "state": "IN_PROGRESS",
        "queued": "2026-10-06T18:45:31-07:00",
        "started": "2026-10-06T18:57:57-07:00"
      },
      {
        "id": "w_0062_2_fry",
        "order_id": "o_0062",
        "station_id": "st_fry",
        "step": "fry",
        "state": "IN_PROGRESS",
        "queued": "2026-10-06T18:45:43-07:00",
        "started": "2026-10-06T18:59:23-07:00"
      },
      {
        "id": "w_0064_3_fry",
        "order_id": "o_0064",
        "station_id": "st_fry",
        "step": "fry",
        "state": "QUEUED",
        "queued": "2026-10-06T18:46:52-07:00",
        "started": null
      },
      {
        "id": "w_0063_1_fry",
        "order_id": "o_0063",
        "station_id": "st_fry",
        "step": "fry",
        "state": "QUEUED",
        "queued": "2026-10-06T18:47:14-07:00",
        "started": null
      },
      {
        "id": "w_0065_2_fry",
        "order_id": "o_0065",
        "station_id": "st_fry",
        "step": "fry",
        "state": "QUEUED",
        "queued": "2026-10-06T18:47:43-07:00",
        "started": null
      },
      {
        "id": "w_0066_2_fry",
        "order_id": "o_0066",
        "station_id": "st_fry",